{"channel":"stable","composition_catalog":{"url":"https://github.com/autonomous-engineering-system/forge-platform/releases/download/forge-platform-composition-catalog-v3/ForgePlatformInstallerCompositionCatalog.json"},"expires_at":"2026-11-13T12:09:21Z","github_release":{"descriptor_asset_name":"ForgePlatformInstallerReleaseDescriptor.json","repository":"autonomous-engineering-system/forge-platform","tag":"forge-platform-installer-v0.4.20"},"installer":{"assets":[{"architecture":"arm64","asset_name":"ForgePlatformInstaller-macos-arm64.zip","bundle_identifier":"com.autonomous-engineering-system.forge-platform-installer","code_directory_sha256":"4f49a4bb6a3c14cd082c813769beaf0602186838908742284a9ac2a383bfda20","digest":"sha256:25ba1ea041d27403feb358c8c38720d1b3d9d86a902507b8165249f8c62aabb9","minimum_macos_version":"26.0.0","notarization_receipt_reference":"receipt:apple-notary-a8b34f6b-8785-4e70-a657-5fb2fe98e3a7","operating_system":"macos","team_identifier":"ZEML4LPXH4"}],"capabilities":["catalog-component-set/v1","composition/v1","composition/v2","composition/v3","helper-package-companion/v1","managed-deployment/v1","managed-python-runtime/v1","provider-fanout/v1","provider-gate/v1","provider-targets/v1","system-launchdaemon/v1"],"policy_revision":"forge-platform-installer-release-v1","provenance_sha256":"5d5d711292c1be9ab430413213b9735ffca1cfc76a0a63dea50e881a3ea2dcd1","release_trust_configuration_sha256":"77ac8c339abf6f2bc12144504fe7146ed0d89643bd384538500601bd2c4f207a","source_revision":"07d3b8d29091410bd6b4928a3f654bb8eed7e8d2","version":"0.4.20"},"published_at":"2026-10-14T12:09:21Z","schema":"forge-platform.installer-release/v1","sequence":42,"signatures":[{"algorithm":"ed25519","key_id":"forge-platform-installer-release-2026-01","signature":"1y8qH8UckAD9O7-5i_H-TlrjXw2x2MHr9t-J6CDoi-qdq9c2OwLldwLyFaAlwSfRPeYde_GrpLTNS6anFHRdDQ"}]}
