{"channel":"stable","composition_catalog":{"url":"https://github.com/autonomous-engineering-system/forge-platform/releases/download/forge-platform-composition-catalog-v3/ForgePlatformInstallerCompositionCatalog.json"},"expires_at":"2026-11-11T17:14:18Z","github_release":{"descriptor_asset_name":"ForgePlatformInstallerReleaseDescriptor.json","repository":"autonomous-engineering-system/forge-platform","tag":"forge-platform-installer-v0.4.14"},"installer":{"assets":[{"architecture":"arm64","asset_name":"ForgePlatformInstaller-macos-arm64.zip","bundle_identifier":"com.autonomous-engineering-system.forge-platform-installer","code_directory_sha256":"a5c2c57f2c24ac7f93cbda576d690b514b4019e808aff56f0983ccaec7b44622","digest":"sha256:150adc2a6ab0768889b69eb1f0fa11fa81e2595654fec2c6d5010252315c721f","minimum_macos_version":"26.0.0","notarization_receipt_reference":"receipt:apple-notary-3a733d12-eee8-45c5-8b0f-4b3aa7a6b22c","operating_system":"macos","team_identifier":"ZEML4LPXH4"}],"capabilities":["catalog-component-set/v1","composition/v1","composition/v2","composition/v3","helper-package-companion/v1","managed-deployment/v1","managed-python-runtime/v1","provider-fanout/v1","provider-gate/v1","provider-targets/v1","system-launchdaemon/v1"],"policy_revision":"forge-platform-installer-release-v1","provenance_sha256":"4b1f5722f539754b0baa8488827fd9aabff5b96bd714e532fd86e03867ccd6b4","release_trust_configuration_sha256":"77ac8c339abf6f2bc12144504fe7146ed0d89643bd384538500601bd2c4f207a","source_revision":"4ce3b5d8a154753e3d1d99944110e7dc08e2f86a","version":"0.4.14"},"published_at":"2026-10-12T17:14:18Z","schema":"forge-platform.installer-release/v1","sequence":39,"signatures":[{"algorithm":"ed25519","key_id":"forge-platform-installer-release-2026-01","signature":"qvtEAHFsWNCGTZTdoDQ52SxO_JyJNFbwLnwY3qfx9u5_Mi6ilDgvLa5A2ISsWdFhERqcDOvQMuaclWSnOHryDg"}]}
